{"artifact_bytes":{"demand_profile":{"bytes":161803,"gzip_bytes":47152},"dispatch_model":{"bytes":61603,"gzip_bytes":15731},"dispatch_results":{"bytes":137128,"gzip_bytes":15115},"dispatch_test_vectors":{"bytes":143506,"gzip_bytes":19219},"facts":{"bytes":3891,"gzip_bytes":1400},"forecast_eval":{"bytes":16308,"gzip_bytes":4375},"forecast_samples":{"bytes":124061,"gzip_bytes":44213},"fuel_mix":{"bytes":92321,"gzip_bytes":29666},"grid_topology":{"bytes":3843,"gzip_bytes":1086},"meta":{"bytes":4447,"gzip_bytes":1827},"quality":{"bytes":7443,"gzip_bytes":1324},"reconciliation":{"bytes":7488,"gzip_bytes":1269},"weather_relation":{"bytes":4058,"gzip_bytes":1983}},"artifact_tags":{"demand_profile":{"annual":"OBSERVED/DERIVED","daily":"OBSERVED/DERIVED","how_mean_mw":"OBSERVED/DERIVED","month_hour_mean_mw":"OBSERVED/DERIVED"},"dispatch_model":{"assumptions":"SIMULATED","battery":"SIMULATED","classes":"SIMULATED/DERIVED","controls":"SIMULATED","days":"OBSERVED/DERIVED","formulation":"SIMULATED","heat_wave":"DERIVED","observed_gen_mw":"OBSERVED","observed_interchange_mw":"OBSERVED","scenarios":"SIMULATED"},"dispatch_results":{"co2":"SIMULATED","dispatch":"SIMULATED","marginal_class":"SIMULATED/DERIVED","price":"SIMULATED","renewable_share":"SIMULATED"},"dispatch_test_vectors":{"expected":"SIMULATED"},"facts":{"bas":"OBSERVED/DERIVED/PREDICTED/SIMULATED","eia_ciso_dayahead_bias_pct":"DERIVED","global":"DERIVED"},"forecast_eval":{"comparisons":"PREDICTED/DERIVED","importance":"DERIVED","intervals":"PREDICTED","models":"PREDICTED"},"forecast_samples":{"actual_mw":"OBSERVED","daily_test":"PREDICTED/DERIVED","eia_mw":"OBSERVED","gbm_mw":"PREDICTED","gbm_p10_mw":"PREDICTED","gbm_p90_mw":"PREDICTED","naive_mw":"PREDICTED"},"fuel_mix":{"annual_share_pct":"OBSERVED/DERIVED","capacity_proxy_mw":"DERIVED","evening_ramp":"DERIVED","month_hour_mean_mw":"OBSERVED/DERIVED"},"grid_topology":{"branches":"SYNTHETIC","buses":"SYNTHETIC","generators":"SYNTHETIC"},"meta":{"sources":"OBSERVED"},"quality":{"dst":"DERIVED","gaps":"OBSERVED/DERIVED","outlier_rules":"DERIVED","spike_examples":"OBSERVED"},"reconciliation":{"balance":"DERIVED","generation_vs_total":"DERIVED","ledger":"OBSERVED/DERIVED","weather":"OBSERVED/DERIVED"},"weather_relation":{"binned":"OBSERVED/DERIVED","model":"DERIVED","pct_demand_per_c_above_base":"DERIVED"}},"attribution":["Source: U.S. Energy Information Administration (EIA-930 Hourly Electric Grid Monitor, bulk file EBA.zip). EIA content here is the observed hourly demand, forecast, generation and interchange series; everything else is this project's own computation.","Weather: NOAA National Centers for Environmental Information, Integrated Surface Database (hourly).","Topology: IEEE PES Power Grid Library pglib-opf, IEEE 14-bus case, CC BY 4.0. Illustrative test system, not a real grid."],"bas":{"CISO":{"fuels":["NG","COL","NUC","OIL","OTH","SUN","WAT","WND"],"name":"California ISO","stations":[{"id":"72295023174","name":"Los Angeles Intl","weight":0.55},{"id":"72494023234","name":"San Francisco Intl","weight":0.2},{"id":"72290023188","name":"San Diego Intl","weight":0.15},{"id":"72483993225","name":"Sacramento Metropolitan","weight":0.1}],"tz":"America/Los_Angeles"},"ERCO":{"fuels":["NG","COL","NUC","OTH","SUN","WAT","WND"],"name":"ERCOT (Texas)","stations":[{"id":"72259003927","name":"Dallas/Fort Worth","weight":0.38},{"id":"72243012960","name":"Houston Intercontinental","weight":0.35},{"id":"72254013904","name":"Austin-Bergstrom","weight":0.14},{"id":"72253012921","name":"San Antonio Intl","weight":0.13}],"tz":"America/Chicago"}},"generated_at":"2026-10-10T05:04:09Z","hours_in_window":40776,"pipeline_version":"0.1.0","schema_version":"v1","sources":{"eia":{"rows_extracted":937020,"url":"https://www.eia.gov/opendata/bulk/EBA.zip","zip_bytes":695225184,"zip_sha256":"da37884447678f87b503d63cd8fceadcf98af2a4b2e8908027c661fa05897dfc"},"noaa":{"files":40,"raw_observations":471874,"url":"https://noaa-global-hourly-pds.s3.amazonaws.com/"},"pglib":{"sha256":"bd5c568621de65e4b0922317010868bc7fa94173807faa10ea8fdbbe77c28106","url":"https://raw.githubusercontent.com/power-grid-lib/pglib-opf/master/pglib_opf_case14_ieee.m"}},"split":{"test":["2024-08-31T23:00:00","2025-08-26T23:00:00"],"train":["2021-01-01T00:00:00","2023-06-30T23:00:00"],"val":["2023-06-30T23:00:00","2024-08-31T23:00:00"]},"tags":{"sources":"OBSERVED"},"window_utc":["2021-01-01T00:00:00","2025-08-26T23:00:00"]}
